{
  "schema_version": 7,
  "route": "dual-sword-v7",
  "atlas_size": [
    4262,
    88
  ],
  "palette_file": "palette.json",
  "body_preview": "preview/yone_v7_actor_card.png",
  "weapon_contract": {
    "version": 2,
    "weapons": [
      "steel",
      "azakana"
    ],
    "always_dual_actions": [
      "idle",
      "run"
    ],
    "semantic_animation_tags": {
      "attack_steel": "steel",
      "attack_azakana": "azakana",
      "skill_q12": "steel",
      "skill_q3": "steel",
      "skill_w_azakana": "azakana",
      "ult": "dual"
    },
    "long_blade_overlay_policy": "caster-follow effects extend the active blade outside the compact actor frame"
  },
  "frames": [
    {
      "action": "skill2",
      "index": 0,
      "file": "frames/skill2_00.png",
      "rect": [
        1970,
        0,
        31,
        49
      ],
      "bottom_margin": 5,
      "face_bbox": [
        12,
        17,
        6,
        10
      ],
      "eye_pixels": [
        [
          14,
          20
        ],
        [
          12,
          19
        ]
      ],
      "mask_bbox": [
        2,
        11,
        10,
        15
      ],
      "foot_zones": [
        [
          1,
          40,
          29,
          4
        ]
      ],
      "face_visibility": "front",
      "active_weapon": "azakana",
      "weapons_present": [
        "steel",
        "azakana"
      ],
      "steel_blade_bbox": [
        26,
        29,
        3,
        9
      ],
      "steel_hand_anchor": [
        27,
        29
      ],
      "steel_tip": [
        26,
        37
      ],
      "steel_span_px": 8.062,
      "steel_connectedness": 1.0,
      "steel_pixel_count": 27,
      "steel_crop_ratio": 1.0,
      "steel_source_tip_survived": true,
      "azakana_blade_bbox": [
        15,
        31,
        14,
        13
      ],
      "azakana_hand_anchor": [
        16,
        32
      ],
      "azakana_tip": [
        28,
        42
      ],
      "azakana_span_px": 15.62,
      "azakana_connectedness": 1.0,
      "azakana_pixel_count": 57,
      "azakana_crop_ratio": 0.5488,
      "azakana_source_tip_survived": true
    },
    {
      "action": "hit",
      "index": 0,
      "file": "frames/hit_00.png",
      "rect": [
        874,
        0,
        43,
        53
      ],
      "bottom_margin": 15,
      "face_bbox": [
        15,
        6,
        7,
        9
      ],
      "eye_pixels": [
        [
          21,
          9
        ]
      ],
      "mask_bbox": [
        3,
        3,
        10,
        13
      ],
      "foot_zones": [
        [
          1,
          34,
          41,
          4
        ]
      ],
      "face_visibility": "profile",
      "active_weapon": "dual",
      "weapons_present": [
        "steel",
        "azakana"
      ],
      "steel_blade_bbox": [
        2,
        26,
        7,
        11
      ],
      "steel_hand_anchor": [
        7,
        26
      ],
      "steel_tip": [
        2,
        36
      ],
      "steel_span_px": 11.18,
      "steel_connectedness": 1.0,
      "steel_pixel_count": 33,
      "steel_crop_ratio": 0.0345,
      "steel_source_tip_survived": true,
      "azakana_blade_bbox": [
        30,
        20,
        11,
        15
      ],
      "azakana_hand_anchor": [
        31,
        21
      ],
      "azakana_tip": [
        39,
        34
      ],
      "azakana_span_px": 15.264,
      "azakana_connectedness": 1.0,
      "azakana_pixel_count": 58,
      "azakana_crop_ratio": 0.0323,
      "azakana_source_tip_survived": true
    },
    {
      "action": "attack",
      "index": 0,
      "file": "frames/attack_00.png",
      "rect": [
        544,
        0,
        45,
        51
      ],
      "bottom_margin": 14,
      "face_bbox": [
        20,
        11,
        6,
        9
      ],
      "eye_pixels": [
        [
          25,
          15
        ]
      ],
      "mask_bbox": [
        10,
        4,
        9,
        10
      ],
      "foot_zones": [
        [
          6,
          33,
          31,
          4
        ]
      ],
      "face_visibility": "profile",
      "active_weapon": "steel",
      "weapons_present": [
        "steel",
        "azakana"
      ],
      "steel_blade_bbox": [
        6,
        26,
        8,
        11
      ],
      "steel_hand_anchor": [
        12,
        27
      ],
      "steel_tip": [
        8,
        36
      ],
      "steel_span_px": 9.849,
      "steel_connectedness": 1.0,
      "steel_pixel_count": 38,
      "steel_crop_ratio": 0.0,
      "steel_source_tip_survived": true,
      "azakana_blade_bbox": [
        28,
        26,
        9,
        11
      ],
      "azakana_hand_anchor": [
        29,
        27
      ],
      "azakana_tip": [
        35,
        36
      ],
      "azakana_span_px": 10.817,
      "azakana_connectedness": 1.0,
      "azakana_pixel_count": 40,
      "azakana_crop_ratio": 0.0,
      "azakana_source_tip_survived": true
    },
    {
      "action": "attack",
      "index": 1,
      "file": "frames/attack_01.png",
      "rect": [
        590,
        0,
        49,
        51
      ],
      "bottom_margin": 14,
      "face_bbox": [
        23,
        9,
        6,
        9
      ],
      "eye_pixels": [
        [
          24,
          12
        ],
        [
          27,
          12
        ]
      ],
      "mask_bbox": [
        13,
        3,
        10,
        14
      ],
      "foot_zones": [
        [
          5,
          33,
          36,
          4
        ]
      ],
      "face_visibility": "front",
      "active_weapon": "steel",
      "weapons_present": [
        "steel",
        "azakana"
      ],
      "steel_blade_bbox": [
        5,
        26,
        10,
        10
      ],
      "steel_hand_anchor": [
        13,
        27
      ],
      "steel_tip": [
        7,
        35
      ],
      "steel_span_px": 10.0,
      "steel_connectedness": 1.0,
      "steel_pixel_count": 40,
      "steel_crop_ratio": 0.0,
      "steel_source_tip_survived": true,
      "azakana_blade_bbox": [
        31,
        24,
        10,
        11
      ],
      "azakana_hand_anchor": [
        32,
        25
      ],
      "azakana_tip": [
        39,
        34
      ],
      "azakana_span_px": 11.402,
      "azakana_connectedness": 1.0,
      "azakana_pixel_count": 43,
      "azakana_crop_ratio": 0.0,
      "azakana_source_tip_survived": true
    },
    {
      "action": "attack",
      "index": 2,
      "file": "frames/attack_02.png",
      "rect": [
        640,
        0,
        59,
        47
      ],
      "bottom_margin": 12,
      "face_bbox": [
        29,
        8,
        6,
        10
      ],
      "eye_pixels": [
        [
          31,
          11
        ],
        [
          34,
          11
        ]
      ],
      "mask_bbox": [
        20,
        3,
        9,
        10
      ],
      "foot_zones": [
        [
          15,
          31,
          38,
          4
        ]
      ],
      "face_visibility": "front",
      "active_weapon": "steel",
      "weapons_present": [
        "steel",
        "azakana"
      ],
      "steel_blade_bbox": [
        41,
        19,
        12,
        5
      ],
      "steel_hand_anchor": [
        42,
        22
      ],
      "steel_tip": [
        52,
        19
      ],
      "steel_span_px": 10.44,
      "steel_connectedness": 1.0,
      "steel_pixel_count": 26,
      "steel_crop_ratio": 0.0,
      "steel_source_tip_survived": true,
      "azakana_blade_bbox": [
        29,
        21,
        3,
        5
      ],
      "azakana_hand_anchor": [
        30,
        21
      ],
      "azakana_tip": [
        29,
        25
      ],
      "azakana_span_px": 4.123,
      "azakana_connectedness": 1.0,
      "azakana_pixel_count": 15,
      "azakana_crop_ratio": 0.0,
      "azakana_source_tip_survived": true
    },
    {
      "action": "attack",
      "index": 3,
      "file": "frames/attack_03.png",
      "rect": [
        700,
        0,
        59,
        49
      ],
      "bottom_margin": 13,
      "face_bbox": [
        31,
        10,
        7,
        10
      ],
      "eye_pixels": [
        [
          33,
          13
        ],
        [
          36,
          13
        ]
      ],
      "mask_bbox": [
        18,
        5,
        11,
        16
      ],
      "foot_zones": [
        [
          16,
          32,
          26,
          4
        ]
      ],
      "face_visibility": "front",
      "active_weapon": "steel",
      "weapons_present": [
        "steel",
        "azakana"
      ],
      "steel_blade_bbox": [
        17,
        20,
        11,
        7
      ],
      "steel_hand_anchor": [
        27,
        25
      ],
      "steel_tip": [
        17,
        20
      ],
      "steel_span_px": 11.18,
      "steel_connectedness": 1.0,
      "steel_pixel_count": 25,
      "steel_crop_ratio": 0.0,
      "steel_source_tip_survived": true,
      "azakana_blade_bbox": [
        26,
        2,
        7,
        6
      ],
      "azakana_hand_anchor": [
        27,
        6
      ],
      "azakana_tip": [
        32,
        4
      ],
      "azakana_span_px": 5.385,
      "azakana_connectedness": 1.0,
      "azakana_pixel_count": 22,
      "azakana_crop_ratio": 0.0,
      "azakana_source_tip_survived": true
    },
    {
      "action": "attack",
      "index": 4,
      "file": "frames/attack_04.png",
      "rect": [
        760,
        0,
        61,
        49
      ],
      "bottom_margin": 13,
      "face_bbox": [
        30,
        13,
        6,
        7
      ],
      "eye_pixels": [
        [
          35,
          16
        ],
        [
          33,
          17
        ]
      ],
      "mask_bbox": [
        20,
        5,
        8,
        16
      ],
      "foot_zones": [
        [
          12,
          32,
          39,
          4
        ]
      ],
      "face_visibility": "front",
      "active_weapon": "steel",
      "weapons_present": [
        "steel",